{
  "configId": "map-rotation",
  "configType": "map_rotation",
  "schemaVersion": 1,
  "configVersion": 7,
  "environment": "stage",
  "status": "published",
  "effectiveFrom": "2026-07-15T00:00:00Z",
  "effectiveTo": "2026-07-22T00:00:00Z",
  "reason": "Weekly staging rotation",
  "checksum": "sha256:example-rotation",
  "clientBuildConstraints": [{"minimumBuild": "1.0.0"}],
  "serverBuildConstraints": [{"minimumBuild": "ds-0.4.0"}],
  "payload": {"rotationId": "weekly-2026-w29", "entries": [{"mapId": "sector7", "modeId": "raid", "weight": 60}, {"mapId": "harbor", "modeId": "raid", "weight": 40}]}
}
